queries,vk.com,m.vk.com,vk.company,rutube.ru,dzen.ru,twitter.com,ok.ru,www.instagram.com
интерны смотреть онлайн вк,9,-,-,-,-,-,-,-
комбинация сериал смотреть онлайн бесплатно вк,9,-,-,-,-,-,-,-
онлайн смотреть закрытый вк,8,-,-,9,-,-,-,-
универ смотреть онлайн вк,1,-,-,-,-,-,-,-
мосгаз метроном смотреть онлайн вк,9,-,-,-,-,-,-,-
вк видео смотреть онлайн бесплатно 4,"1, 2",-,-,5,4,-,-,-
душа смотреть онлайн вк,-,-,-,-,-,-,-,-
король смотреть онлайн в вк,1,-,-,2,-,-,3,-
убийца смотреть онлайн вк,1,-,-,4,-,-,3,-
вк пес смотреть онлайн,7,-,-,-,-,-,-,-
зимородок 3 смотреть онлайн вк,7,-,-,-,-,-,-,-
юфс 308 прямой эфир смотреть онлайн вк,-,-,-,-,-,-,-,-
головоломка смотреть онлайн вк,1,-,-,2,-,-,-,-
дэдпул и росомаха смотреть онлайн вк,1,-,-,-,-,-,-,-
кольца власти смотреть онлайн вк,1,-,-,-,-,-,-,-
небо смотреть онлайн вк,-,-,-,-,-,-,-,-
веном 2 смотреть онлайн вк,1,-,-,2,-,-,-,-
зимородок 3 сезон смотреть онлайн вк,10,-,-,-,-,-,-,-
отцы смотреть онлайн вк,"1, 2",-,-,-,-,-,5,-
фильм игра смотреть онлайн вк,1,-,-,-,-,-,2,-
сваты 7 смотреть онлайн вк,-,-,-,-,-,-,-,-
фильм субстанция 2024 смотреть онлайн вк видео,10,-,-,-,-,-,-,-
гусар 2 смотреть онлайн вк,8,-,-,-,-,-,-,-
джентльмены фильм 2019 смотреть онлайн вк,-,-,-,-,-,-,-,-
викинги смотреть онлайн вк,1,-,-,2,-,-,-,-
динамо ростов смотреть онлайн бесплатно вк,-,-,-,-,-,-,-,-
сумерки 1 смотреть онлайн вк,7,-,-,-,-,-,-,-
вк смотреть фильмы онлайн 2014,1,-,-,10,-,-,-,-
еретик фильм смотреть онлайн вк,9,-,-,10,-,-,-,-
слово пацана смотреть онлайн 2 серия вк,-,-,-,-,-,-,-,-
хороший доктор вк смотреть онлайн,1,-,-,2,-,-,-,-
арсенал ливерпуль смотреть онлайн вк,1,-,-,6,-,-,-,-
веном последний танец 2024 смотреть онлайн вк,1,-,-,-,-,-,-,-
мелодрамы в вк смотреть онлайн бесплатно,"1, 2, 3",-,-,-,-,-,-,-
форсаж смотреть онлайн бесплатно в вк,1,-,-,5,-,-,10,-
брат смотреть онлайн вк,8,-,-,9,-,-,-,-
ufc 309 смотреть онлайн вк,1,-,-,-,-,-,4,-
юфс 308 смотреть онлайн бесплатно прямой вк,-,-,-,-,-,-,-,-
юфс 309 смотреть онлайн вк,1,-,-,-,-,-,6,-
вк фильмы 2018 онлайн смотреть,1,-,-,-,-,-,-,-
ходячие мертвецы сериал смотреть онлайн вк,-,-,-,-,-,-,-,-
кино 2024 смотреть онлайн в вк,"1, 2, 3, 4",-,-,-,-,-,-,-
леди баг смотреть онлайн вк,8,-,-,-,-,-,-,-
наследники дар крови смотреть онлайн бесплатно вк,9,-,-,-,-,-,-,-
унесенные призраками смотреть онлайн вк,-,-,-,-,-,-,-,-
во все тяжкие смотреть онлайн вк,1,-,-,2,-,-,-,-
женское дело смотреть онлайн вк,-,-,-,-,-,-,-,-
сверхъестественное смотреть онлайн бесплатно вк,-,-,-,-,-,-,-,-
субстанция смотреть онлайн бесплатно 2024 вк видео,10,-,-,-,-,-,-,-
очень странные дела смотреть онлайн вк,"1, 2",-,-,3,-,-,10,-
пацанки 9 сезон смотреть онлайн бесплатно вк,-,-,-,-,-,-,-,-
смотреть фильмы ужасов онлайн вк,"1, 2, 3",-,-,10,-,-,7,-
ходячие мертвецы смотреть онлайн бесплатно вк,-,-,-,-,-,-,-,-
теннис онлайн смотреть сегодня вк,"1, 2",-,-,-,-,-,-,-
маме снова 17 смотреть онлайн бесплатно вк,-,-,-,-,-,-,-,-
трасса 2 серия смотреть онлайн вк,8,-,-,-,10,-,-,-
король талсы смотреть онлайн вк,1,-,-,7,-,-,-,-
лига чемпионов смотреть онлайн вк,"1, 2",-,-,-,-,-,-,-
чернобыль смотреть онлайн вк,-,-,-,-,-,-,-,-
ведьмы смотреть онлайн вк,1,-,-,3,-,-,-,-
министерство неджентльменских дел смотреть онлайн бесплатно вк,8,-,-,-,-,-,-,-
моя вина смотреть онлайн вк,1,-,-,4,-,-,-,-
новинки кино 2024 смотреть онлайн вк,"1, 2, 3, 4",-,-,10,-,-,-,-
вк видео смотреть онлайн мультфильмы,"1, 2",-,-,3,4,-,-,-
властелин колец смотреть онлайн бесплатно вк,1,-,-,5,-,-,-,-
зона комфорта смотреть онлайн вк,-,-,-,-,-,-,-,-
пчеловод фильм смотреть онлайн бесплатно вк,8,-,-,-,-,-,-,-
склифосовский смотреть онлайн вк,8,-,-,-,-,-,-,-
слово пацана смотреть онлайн все серии вк,-,-,-,-,-,-,-,-
фильмы 2017 смотреть онлайн вк,1,-,-,-,-,-,-,-
а4 смотреть онлайн вк,"1, 2",-,-,4,5,-,3,-
жестокий стамбул смотреть онлайн вк,2,-,-,-,-,-,-,-
моана смотреть онлайн вк,-,-,-,-,-,-,-,-
веном 2024 смотреть онлайн бесплатно вк,1,-,-,4,-,-,9,-
праздники смотреть онлайн бесплатно вк,10,-,-,-,-,-,-,-
шрек смотреть онлайн бесплатно вк,"1, 2",-,-,6,-,-,-,-
сумерки 1 часть смотреть онлайн вк,6,-,-,-,-,-,-,-
тьма смотреть онлайн вк,1,-,-,3,-,-,6,-
бумажный дом смотреть онлайн вк,"1, 2",-,-,3,-,-,9,-
мастер и маргарита смотреть онлайн вк,7,-,-,-,-,-,-,-
молодежка новый сезон 2024 смотреть онлайн вк,-,-,-,-,-,-,-,-
новые фильмы смотреть онлайн вк,"1, 2, 3",-,-,-,-,-,-,-
аркейн вк смотреть онлайн,1,-,-,3,-,-,-,-
майор гром смотреть онлайн вк,8,-,-,-,-,-,-,-
сериал наследники смотреть онлайн вк,"1, 2",-,-,-,-,-,-,-
гладиатор 2 смотреть онлайн вк,3,-,-,2,-,-,6,-
русские фильмы 2023 смотреть онлайн вк,1,-,-,-,-,-,-,-
смотреть вк аниме онлайн все серии,"1, 2",-,-,3,-,-,6,-
шекер смотреть онлайн вк,7,-,-,8,-,-,-,-
джокер 2 смотреть онлайн вк,1,-,-,3,-,-,10,-
смотреть онлайн вк тело,1,-,-,2,-,-,3,-
триггер 3 сезон смотреть онлайн бесплатно вк,-,-,-,-,-,-,-,-
ужасающий 1 смотреть онлайн вк,1,-,-,-,-,-,-,-
ольга смотреть онлайн вк,6,-,-,-,-,-,-,-
пираты карибского моря смотреть онлайн вк,"1, 2",-,-,3,-,-,10,-
смотреть онлайн бесплатно шеф вк,1,-,-,-,-,-,-,-
порно фильмы онлайн смотреть вк,"1, 2",-,-,-,-,-,-,-
праздники сериал смотреть онлайн вк,-,-,-,-,-,-,-,-
беляковы в отпуске смотреть онлайн вк,10,-,-,-,-,-,-,-
гнев смотреть онлайн вк,3,-,-,8,-,-,7,-
джентльмены фильм смотреть онлайн бесплатно вк,-,-,-,-,-,-,-,-
друзья смотреть онлайн бесплатно вк,-,-,-,-,-,-,-,-
женский форум смотреть онлайн вк,"1, 2",-,-,-,-,-,-,-
маргарита сериал смотреть онлайн вк,"7, 8",-,-,-,-,-,-,-
форс мажоры смотреть онлайн вк,1,-,-,-,-,-,-,-
дневники вампира смотреть онлайн бесплатно вк,1,-,-,2,-,-,7,-
йеллоустоун смотреть онлайн вк,"1, 2",-,-,7,-,-,10,-
непослушная смотреть онлайн вк,-,-,-,-,-,-,-,-
дикий ангел смотреть онлайн вк,7,-,-,-,-,-,-,-
дом дракона смотреть онлайн бесплатно вк,10,-,-,-,-,-,-,-
руки вверх фильм смотреть онлайн бесплатно вк,10,-,-,-,-,-,-,-
сериал комитет смотреть онлайн вк,9,-,-,-,-,-,-,-
еретик фильм 2024 смотреть онлайн вк,10,-,-,9,-,-,-,-
невский сериал смотреть онлайн бесплатно вк,9,-,-,-,-,-,-,-
смотреть онлайн в вк тень,1,-,-,4,-,-,2,-
вк видео смотреть онлайн а4,"1, 2",-,-,4,5,-,6,-
головоломка 2 смотреть онлайн вк,1,-,-,-,-,-,-,-
основание смотреть онлайн вк,6,-,-,7,-,-,-,-
стражи галактики смотреть онлайн вк,"1, 2",-,-,4,-,-,9,-
хороший доктор смотреть онлайн бесплатно вк,1,-,-,2,-,-,-,-
битва экстрасенсов смотреть онлайн вк,"1, 2",-,-,3,-,-,-,-
звезды вк смотреть онлайн бесплатно,1,-,-,-,-,-,-,-
король талсы 2 смотреть онлайн вк,1,-,-,6,-,-,-,-
сваты 7 смотреть онлайн бесплатно вк,-,-,-,9,10,-,-,-
трон смотреть онлайн вк,1,-,-,2,-,-,-,-
клюквенный щербет смотреть онлайн вк,-,-,-,-,-,-,-,-
реал боруссия смотреть онлайн бесплатно вк,1,-,-,-,-,-,-,-
сестры смотреть онлайн бесплатно вк,-,-,-,-,-,-,-,-
мосгаз метроном смотреть онлайн бесплатно вк,-,-,-,-,-,-,-,-
все закончится на нас смотреть онлайн вк,1,-,-,2,-,-,-,-
гарри поттер все части смотреть онлайн вк,1,-,-,3,-,-,-,-
пчеловод 2024 смотреть онлайн вк,-,-,-,-,-,-,-,-
21 смотреть онлайн вк,1,-,-,4,-,-,2,-
время фильм смотреть онлайн вк,1,-,-,2,-,-,5,-
дом 2 смотреть онлайн вк,4,-,-,-,-,-,-,-
дэдпул смотреть онлайн бесплатно вк,1,-,-,3,-,-,-,-
крик смотреть онлайн вк,1,-,-,5,-,-,-,-
порно фильмы смотреть онлайн бесплатно вк,"1, 2",-,-,-,-,-,-,-
смотреть тв онлайн бесплатно вк,1,-,-,2,-,-,-,-
голяк смотреть онлайн вк,"1, 2",-,-,5,-,-,-,-
гравити фолз вк смотреть онлайн,-,-,-,-,-,-,-,-
извне 3 сезон смотреть онлайн бесплатно вк,1,-,-,7,-,-,-,-
настоящий детектив смотреть онлайн вк,9,-,-,-,-,-,-,-
триггер сериал смотреть онлайн бесплатно вк,9,-,-,-,-,-,-,-
фильм бойцовский клуб смотреть онлайн вк,"1, 2",-,-,4,-,-,6,-
чикатило смотреть онлайн вк,6,-,-,-,-,-,10,-
вк комедии смотреть онлайн бесплатно,"1, 2",-,-,5,-,-,-,-
молодежка новый сезон смотреть онлайн бесплатно вк,-,-,-,-,-,-,-,-
овчарка сериал смотреть онлайн вк,-,-,-,-,-,-,-,-
битлджус смотреть онлайн вк,1,-,-,4,-,-,3,-
ворон 2024 смотреть онлайн бесплатно вк,-,-,-,-,-,-,-,-
гарри поттер 1 смотреть онлайн вк,1,-,-,5,-,-,-,-
игра престолов смотреть онлайн 1 сезон вк,9,-,-,-,-,-,-,-
карпов вк смотреть онлайн,-,-,-,-,-,-,-,-
реал осасуна смотреть онлайн вк,1,-,-,6,-,-,4,-
ужасающий 2 фильм смотреть онлайн вк,8,-,-,-,-,-,-,-
холоп смотреть онлайн вк,8,-,-,-,-,-,-,-
чужой ромул смотреть онлайн вк,1,-,-,-,-,-,-,-
барселона эспаньол смотреть онлайн вк,1,-,-,2,-,-,-,-
кино 2024 смотреть онлайн бесплатно вк,"1, 2, 3",-,-,-,-,-,-,-
король талсы 2 сезон смотреть онлайн вк,-,-,-,-,-,-,-,-
сеструха смотреть онлайн вк,1,-,-,-,-,-,10,-
вк видео смотреть онлайн мультики,1,-,-,3,2,-,-,-
другие смотреть онлайн бесплатно вк,-,-,-,-,-,-,-,-
острые козырьки смотреть онлайн вк,"1, 2",-,-,3,-,-,-,-
смотреть онлайн вк ютуб,2,-,-,4,5,-,-,9
контакт смотреть онлайн вк,1,-,-,2,-,-,5,-
пассажиры смотреть онлайн вк,-,-,-,-,-,-,-,-
после смотреть онлайн бесплатно вк,10,-,-,-,-,-,-,-
семь смотреть онлайн вк,"1, 2",-,-,6,-,-,4,-
уральские пельмени смотреть онлайн вк,"1, 2",-,-,-,6,-,3,-
фильм большой смотреть онлайн вк,1,-,-,3,-,-,7,-
бойцовский клуб смотреть онлайн бесплатно вк,9,-,-,10,-,-,-,-
гнев человеческий смотреть онлайн вк,8,-,-,-,-,-,-,-
женское дело сериал смотреть онлайн вк,10,-,-,-,-,-,-,-
милые обманщицы смотреть онлайн вк,"1, 2",-,-,-,-,-,-,-
большой потенциал смотреть онлайн вк,1,-,-,2,-,-,-,-
голодные игры смотреть онлайн вк,-,-,-,-,-,-,-,-
мир дружба жвачка смотреть онлайн бесплатно вк,5,-,-,8,-,-,-,-
анора фильм смотреть онлайн вк,-,-,-,7,-,-,-,-
наследники дар крови сериал смотреть онлайн вк,9,-,-,-,-,-,-,-
пацаны 2 сезон смотреть онлайн вк,1,-,-,-,-,-,-,-
трасса сериал 2024 смотреть онлайн бесплатно вк,-,-,-,-,-,-,-,-
ужасы фильмы смотреть онлайн вк бесплатно,"1, 2",-,-,6,-,-,4,-
анора смотреть онлайн бесплатно вк,-,-,-,-,-,-,-,-
вышка смотреть онлайн вк,9,-,-,-,-,-,-,-
ловушка смотреть онлайн вк,1,-,-,6,-,-,-,-
три кота смотреть онлайн вк,"1, 2",-,-,6,9,-,-,-
гадкий я смотреть онлайн вк,1,-,-,2,-,-,-,-
реал дортмунд смотреть онлайн вк,1,-,-,8,-,-,7,-
смотреть онлайн русское порно вк,1,-,-,-,-,-,-,-
сумерки 1 смотреть онлайн бесплатно вк,"9, 10",-,-,-,-,-,-,-
железный человек смотреть онлайн вк,1,-,-,4,-,-,-,-
импроком вк смотреть онлайн,"1, 2, 3",-,-,-,-,-,-,8
охота смотреть онлайн вк,1,-,-,-,7,-,2,-
пчеловод фильм 2024 смотреть онлайн вк,8,-,-,10,-,-,-,-
секс в большом городе смотреть онлайн вк,8,-,-,10,-,-,-,-
фильмы 2020 смотреть онлайн бесплатно вк,1,-,-,5,-,-,-,-
эйфория смотреть онлайн бесплатно вк,8,-,-,-,-,-,-,-
невский 7 сезон смотреть онлайн бесплатно вк,-,-,-,-,-,-,-,-
огниво смотреть онлайн вк,"7, 8",-,-,-,-,-,-,-
барселона црвена звезда смотреть онлайн вк,-,-,-,-,-,-,-,-
бывшие фильм смотреть онлайн вк,-,-,-,-,-,-,-,-
основание осман смотреть онлайн вк,8,-,-,-,-,-,-,-
зимородок 3 сезон смотреть онлайн бесплатно вк,-,-,-,-,-,-,-,-
мама будет против смотреть онлайн вк,7,-,-,-,-,-,-,-
милые обманщицы смотреть онлайн бесплатно вк,1,-,-,-,-,-,-,-
новинки фильмов смотреть онлайн вк,"1, 2, 3",-,-,6,-,-,-,-
пингвин смотреть онлайн бесплатно вк,1,-,-,3,-,-,-,-
смотреть онлайн бесплатно великолепный вк,-,-,-,-,-,-,-,-
фишер смотреть онлайн вк,-,-,-,-,-,-,-,-
чернобыль зона отчуждения смотреть онлайн вк,"8, 9",-,-,-,-,-,-,-
бригада смотреть онлайн все серии вк,1,-,-,3,-,-,-,-
дюна 2 смотреть онлайн вк,10,-,-,-,-,-,-,-
кровь на асфальте смотреть онлайн вк,8,-,-,-,-,-,-,-
трудная смотреть онлайн вк,-,-,-,-,-,-,-,-
гримм смотреть онлайн вк,"1, 2",-,-,10,-,-,-,-
домашний смотреть онлайн в вк,1,-,-,-,-,-,-,-
люцифер смотреть онлайн вк,"1, 2",-,-,3,-,-,5,-
руки вверх фильм 2024 смотреть онлайн вк,9,-,-,-,-,-,-,-
2012 фильм смотреть онлайн вк,"1, 2",-,-,3,-,-,-,-
сумерки 1 часть смотреть онлайн бесплатно вк,7,-,-,-,-,-,-,-
1 дома смотреть онлайн вк,1,-,-,5,-,-,6,-
бременские музыканты смотреть онлайн вк,7,-,-,10,-,-,-,-
волчонок смотреть онлайн вк,1,-,-,2,-,-,-,-
комитет смотреть онлайн в вк,10,-,-,-,-,-,-,-
спартак акрон смотреть онлайн бесплатно вк,5,-,-,2,-,-,-,-
формула 1 смотреть онлайн вк,"1, 2",-,-,7,-,-,-,-
волк с уолл стрит смотреть онлайн вк,6,-,-,7,-,-,-,-
достать ножи смотреть онлайн вк,7,-,-,8,-,-,-,-
зимородок смотреть онлайн бесплатно в вк,9,-,-,-,-,-,-,-
отмель смотреть онлайн вк,1,-,-,3,-,-,2,-
пес смотреть онлайн бесплатно вк,7,-,-,-,-,-,-,-
рутуб смотреть онлайн бесплатно вк,1,-,-,2,3,-,-,-
смотреть вк анонимно онлайн бесплатно,-,-,-,-,-,-,-,-
шерлок смотреть онлайн вк,"1, 2",-,-,4,-,-,-,-
жить жизнь смотреть онлайн бесплатно вк,10,-,-,-,-,-,-,-
как приручить дракона смотреть онлайн вк,1,-,-,2,-,-,7,-
триггер 3 смотреть онлайн бесплатно в вк,10,-,-,-,-,-,-,-
хоббит смотреть онлайн вк,1,-,-,3,-,-,-,-
еретик смотреть онлайн бесплатно вк,8,-,-,9,-,-,-,-
жестокий стамбул смотреть онлайн бесплатно вк,-,-,-,-,-,-,-,-
клинок рассекающий демонов смотреть онлайн вк,"1, 2",-,-,9,-,-,-,-
комбинация смотреть онлайн бесплатно 2024 вк,10,-,-,-,-,-,-,-
русские 5 серия смотреть онлайн вк,1,-,-,6,-,-,-,-
ливерпуль байер смотреть онлайн вк,3,-,-,4,-,-,-,-
реал милан смотреть онлайн бесплатно вк,-,-,-,-,10,-,-,-
большое переселение смотреть онлайн вк,1,-,-,-,-,-,-,-
джентльмены 2019 смотреть онлайн бесплатно вк,-,-,-,-,-,-,-,-
мимимишки смотреть онлайн вк,-,-,-,-,-,-,-,-
противостояние сериал смотреть онлайн вк,10,-,-,-,-,-,-,-
шекер смотреть онлайн бесплатно вк,10,-,-,-,-,-,-,-
бригада смотреть онлайн бесплатно вк,1,-,-,2,-,-,-,-
гравити фолз смотреть онлайн бесплатно вк,-,-,-,-,-,-,-,-
декстер смотреть онлайн вк,8,-,-,-,-,-,-,-
ричер смотреть онлайн вк,5,-,-,-,-,-,6,-
сериал зона смотреть онлайн вк,1,-,-,7,-,-,3,-
ходячий замок смотреть онлайн вк,-,-,-,-,-,-,-,-
юфс прямая трансляция смотреть онлайн вк,"1, 2",-,-,8,5,-,-,-
бойцовский клуб фильм смотреть онлайн бесплатно вк,1,-,-,3,-,-,5,-
бывшие сериал смотреть онлайн вк,-,-,-,-,-,-,-,-
красный фильм 2024 смотреть онлайн вк,3,-,-,-,-,-,-,-
гарри поттер 1 часть смотреть онлайн вк,1,-,-,4,-,-,-,-
лейла смотреть онлайн вк,6,-,-,-,-,-,-,-
маргарита сериал 2024 смотреть онлайн вк,7,-,-,-,-,-,-,-
миссия красный фильм смотреть онлайн вк,2,-,-,-,-,-,-,-
никто смотреть онлайн вк,1,-,-,3,-,-,8,-
реал мадрид барселона смотреть онлайн вк,1,-,-,2,-,-,-,-
сериал друзья смотреть онлайн вк,-,-,-,-,-,-,-,-
слово пацана 2 сезон смотреть онлайн вк,-,-,-,-,-,-,-,-
аль хиляль аль наср смотреть онлайн вк,10,-,-,-,-,-,-,-
женщина в вк смотреть онлайн бесплатно,"1, 2",-,-,-,-,-,-,-
дюна смотреть онлайн бесплатное вк,-,-,-,-,-,-,-,-
женское дело смотреть онлайн бесплатно вк,-,-,-,-,-,-,-,-
комбинация сериал 2024 смотреть онлайн вк,9,-,-,-,-,-,-,-
мадагаскар смотреть онлайн вк,"1, 2",-,-,-,-,-,7,-
лихие сериал 2024 смотреть онлайн вк,-,-,-,-,-,-,-,-
пацаны сериал смотреть онлайн вк,1,-,-,-,-,-,-,-
противостояние сериал 2024 смотреть онлайн вк,-,-,-,-,-,-,-,-
аватар смотреть онлайн бесплатно вк,"1, 2",-,-,4,-,-,-,-
ведьмак смотреть онлайн в вк,-,-,-,-,-,-,-,-
головоломка смотреть онлайн бесплатно вк,1,-,-,3,-,-,-,-
зло сериал смотреть онлайн вк,-,-,-,-,-,-,-,-
хищные земли смотреть онлайн вк,1,-,-,-,-,-,9,-
дикий робот смотреть онлайн бесплатно вк,1,-,-,4,-,-,-,-
крестный отец смотреть онлайн вк,"1, 2",-,-,4,-,-,8,-
майор гром смотреть онлайн бесплатно вк,8,-,-,-,-,-,-,-
молодежка 7 сезон смотреть онлайн вк,-,-,-,-,-,-,-,-
мосгаз сериал смотреть онлайн вк,-,-,-,-,-,-,-,-
остаться в живых смотреть онлайн вк,-,-,-,-,-,-,-,-
пила смотреть онлайн вк,-,-,-,-,-,-,-,-
титаны смотреть онлайн вк,"1, 2",-,-,5,-,-,-,-
джентльмены фильм 2019 смотреть онлайн бесплатно вк,-,-,-,-,-,-,-,-
министерство неджентельменских дел смотреть онлайн вк,10,-,-,-,-,-,-,-
праздники сериал смотреть онлайн бесплатно вк,-,-,-,-,-,-,-,-
тачки смотреть онлайн вк,"1, 2",-,-,3,-,-,-,-
универ смотреть онлайн бесплатно вк,1,-,-,-,-,-,-,-
хрустальный смотреть онлайн вк,1,-,-,-,-,-,-,-
дэдпул и росомаха смотреть онлайн бесплатно вк,1,-,-,-,-,-,-,-
закрытая школа смотреть онлайн вк,-,-,-,-,-,-,-,-
клюквенный щербет смотреть онлайн бесплатно вк,-,-,-,-,-,-,-,-
миссия красный смотреть онлайн бесплатно вк,7,-,-,-,-,-,-,-
пингвин сериал смотреть онлайн бесплатно вк,1,-,-,2,-,-,-,-
русские 6 серия смотреть онлайн вк,1,-,-,-,-,-,3,-
сериалы 2020 смотреть онлайн в вк,1,-,-,-,-,-,-,-
сеструха сериал смотреть онлайн вк,1,-,-,-,-,-,-,-
смотреть онлайн мстители война вк,"1, 2",-,-,5,-,-,-,-
трансформеры начало смотреть онлайн вк,1,-,-,2,-,-,-,-
ужасающий 1 смотреть онлайн бесплатно вк,1,-,-,-,-,-,-,-
ufc смотреть онлайн прямая трансляция вк,"1, 2",-,-,-,-,-,-,-
бесконечность смотреть онлайн вк,8,-,-,10,-,-,9,-
бриджертоны смотреть онлайн вк,1,-,-,2,-,-,7,-
