queries,vk.com,m.vk.com,vk.company,rutube.ru,dzen.ru,twitter.com,ok.ru,www.instagram.com
шрек 3 смотреть онлайн рутуб,4,-,-,"1, 2",-,-,-,-
босс молокосос 1 смотреть онлайн рутуб,-,-,-,-,-,-,-,-
бригада сериал смотреть онлайн рутубе,-,-,-,"1, 2",-,-,-,-
две девицы на мели смотреть онлайн рутуб,-,-,-,"1, 2",-,-,-,-
достать ножи смотреть онлайн рутуб,9,-,-,8,-,-,-,-
женское дело сериал смотреть онлайн рутуб,-,-,-,-,-,-,-,-
коломбо смотреть онлайн рутуб,7,-,-,"1, 2, 3",-,-,10,-
наследники дорама смотреть онлайн рутубе,3,-,-,"1, 2",-,-,-,-
плевако смотреть онлайн рутуб,-,-,-,-,-,-,-,-
пчеловод фильм 2024 смотреть онлайн рутуб,-,-,-,-,-,-,-,-
ривердейл смотреть онлайн рутуб,-,-,-,1,-,-,-,-
рутуб 4 свадьбы смотреть онлайн,-,-,-,1,-,-,-,-
рутубе след бесплатно онлайн смотреть сериал новые,-,-,-,-,-,-,-,-
сверхъестественное смотреть онлайн 1 сезон рутуб,6,-,-,"1, 2",-,-,-,-
сериал дневники вампира смотреть онлайн рутуб,6,-,-,"1, 2, 3",-,-,-,-
трасса 2 серия смотреть онлайн рутуб,-,-,-,-,-,-,-,-
царевны смотреть онлайн рутуб,-,-,-,"1, 2",-,-,-,-
аркейн 2 сезон смотреть онлайн рутуб,7,-,-,"1, 2",-,-,-,-
бордерлендс смотреть онлайн бесплатно рутуб,-,-,-,"8, 9",-,-,-,-
брат смотреть онлайн бесплатно рутуб,-,-,-,"7, 8",-,-,-,-
