queries,vk.com,m.vk.com,vk.company,rutube.ru,dzen.ru,twitter.com,ok.ru,www.instagram.com
смотреть онлайн вк,1,-,-,-,5,-,-,8
вк смотреть онлайн бесплатно,1,-,-,-,3,-,-,-
вк видео смотреть онлайн бесплатно,1,-,-,-,2,-,-,-
смотреть онлайн в хорошем качестве вк,"1, 2",-,-,3,4,-,-,-
вк смотреть онлайн бесплатно в хорошем качестве,"1, 2",-,-,4,3,-,-,-
смотреть фильмы онлайн вк,"1, 2, 3",-,-,5,-,-,-,-
вк смотреть онлайн сериал,"1, 2, 3",-,-,-,-,-,-,-
лучшие фильмы смотреть онлайн вк,"1, 2, 3",-,-,6,-,-,-,-
вк фильмы онлайн смотреть бесплатно в хорошем,"1, 2, 3",-,-,4,-,-,10,-
видео в вк смотреть онлайн,1,-,-,-,2,-,-,-
вк видео смотреть онлайн бесплатно в хорошем,1,-,-,-,2,-,-,-
вк сериал онлайн смотреть бесплатно,"1, 2",-,-,-,-,-,-,-
1 1 смотреть онлайн вк,"1, 2",-,-,9,-,-,5,-
фильм 2024 смотреть онлайн бесплатно вк,"1, 2, 3",-,-,-,-,-,-,-
субстанция смотреть онлайн вк,9,-,-,10,-,-,-,-
фильмы в вк 2024 смотреть онлайн,"1, 2",-,-,6,-,-,9,-
фильмы на вк смотреть онлайн бесплатно,"1, 2, 3",-,-,7,9,-,-,-
субстанция фильм смотреть онлайн вк,10,-,-,-,-,-,-,-
субстанция смотреть онлайн бесплатно вк,-,-,-,-,-,-,-,-
субстанция фильм смотреть онлайн бесплатно вк,7,-,-,8,-,-,-,-
субстанция 2024 смотреть онлайн вк,-,-,-,-,-,-,-,-
субстанция фильм 2024 смотреть онлайн вк,-,-,-,-,-,-,-,-
смотреть вк без регистрации онлайн,1,-,-,8,6,-,-,-
смотреть вк без регистрации онлайн бесплатно,"1, 2",-,-,-,-,-,-,-
субстанция 2024 смотреть онлайн бесплатно вк,-,-,-,-,-,-,-,-
субстанция смотреть онлайн бесплатно в хорошем вк,7,-,-,8,-,-,-,-
фильм субстанция 2024 смотреть онлайн бесплатно вк,-,-,-,-,-,-,-,-
субстанция смотреть онлайн в хорошем качестве вк,6,-,-,7,-,-,-,-
вк видео смотреть без онлайн,1,-,-,-,5,-,-,-
вк видео смотреть онлайн без регистрации,1,-,-,-,3,-,-,-
вк видео смотреть без регистрации бесплатно онлайн,1,-,-,-,2,-,-,-
вк в 1 сезон смотреть онлайн,1,-,-,-,-,-,-,-
ужасающий смотреть онлайн вк,1,-,-,4,-,-,-,-
смотреть онлайн дорамы вк,"1, 2",-,-,9,-,-,-,-
вк видео сериалы смотреть онлайн,"1, 2, 3",-,-,-,-,-,-,-
сериалы 2024 смотреть онлайн вк,"1, 2, 3",-,-,9,-,-,-,-
вк видео смотреть онлайн фильмы,1,-,-,3,-,-,-,-
веном смотреть онлайн вк,1,-,-,2,-,-,-,-
смотреть онлайн последний вк,1,-,-,-,5,-,-,-
ужасающий смотреть онлайн бесплатно вк,1,-,-,-,-,-,-,-
смотреть онлайн мультфильмы вк,"1, 2",-,-,4,8,-,-,-
юфс смотреть онлайн вк,"1, 2",-,-,5,8,-,-,-
вк видео смотреть онлайн бесплатно фильмы,1,-,-,3,-,-,7,-
смотреть трансляции онлайн вк,1,-,-,5,8,-,-,-
ужасающий 3 смотреть онлайн вк,1,-,-,-,-,-,-,-
смотреть онлайн через вк,1,-,-,-,-,-,-,-
русские сериалы вк смотреть онлайн,1,-,-,-,-,-,-,-
вк видео сериалы смотреть онлайн бесплатно,"1, 2, 3",-,-,-,-,-,-,-
вк смотреть кино онлайн,"1, 2, 3",-,-,7,-,-,-,-
фильмы 2023 смотреть онлайн вк,"1, 2",-,-,-,-,-,-,-
сериалы 2024 смотреть онлайн бесплатно вк,"1, 2, 3",-,-,-,-,-,-,-
игра смотреть онлайн вк,6,-,-,-,-,-,-,-
вк сериал 2 сезон смотреть онлайн,1,-,-,5,-,-,-,-
веном 3 смотреть онлайн вк,8,-,-,-,-,-,-,-
аниме смотреть онлайн вк,"1, 2",-,-,-,-,-,-,-
вк смотреть мультфильмы онлайн бесплатно,1,-,-,4,5,-,-,-
прямые трансляции вк онлайн смотреть,1,-,-,6,9,-,-,-
ужасающий 3 смотреть онлайн бесплатно вк,1,-,-,-,-,-,-,-
пацаны смотреть онлайн вк,1,-,-,-,-,-,-,-
юфс 308 смотреть онлайн вк,-,-,-,-,-,-,-,-
ufc вк смотреть онлайн,"1, 2",-,-,-,6,-,-,-
смотреть порно онлайн вк,"1, 2, 3",-,-,-,-,-,-,-
вк видео 2024 смотреть онлайн,"1, 2, 3",-,-,4,5,-,-,-
невский смотреть онлайн вк,9,-,-,-,-,-,-,-
большой смотреть онлайн вк,1,-,-,6,-,-,4,-
веном смотреть онлайн бесплатно вк,1,-,-,4,-,-,-,-
фильм ужасающий вк смотрите онлайн,1,-,-,3,-,-,-,-
вк прямой эфир смотреть онлайн,1,-,-,7,9,-,-,-
слово пацана смотреть онлайн вк,-,-,-,-,-,-,-,-
молодежка смотреть онлайн вк,-,-,-,-,-,-,-,-
фильм онлайн смотреть бесплатно 2023 вк,"1, 2",-,-,8,-,-,6,-
трасса смотреть онлайн вк,-,-,-,-,-,-,-,-
вк турецкие сериалы смотреть онлайн,10,-,-,-,-,-,-,-
дела смотреть вк онлайн,"1, 2",-,-,-,-,-,-,-
ужасающий 2 смотреть онлайн вк,9,-,-,-,-,-,-,-
барселона смотреть онлайн вк,1,-,-,2,-,-,-,-
гарри поттер смотреть онлайн вк,"1, 2",-,-,5,-,-,-,-
смотреть теннис онлайн вк,"1, 2",-,-,-,-,-,-,-
смотреть онлайн 2021 вк,"1, 2",-,-,-,-,-,9,-
дом смотреть онлайн вк,4,-,-,-,-,-,5,-
мира смотреть онлайн вк,8,-,-,-,-,-,-,-
вк онлайн люди смотреть,2,-,-,-,10,-,-,-
онлайн смотреть истории вк,-,-,-,-,-,-,-,-
ужасающий 3 фильм смотреть онлайн вк,1,-,-,-,-,-,-,-
отчаянные домохозяйки смотреть онлайн вк,"1, 2",-,-,3,-,-,-,-
вк кино онлайн смотреть бесплатно,"1, 2, 3",-,-,7,-,-,-,-
вызов смотреть онлайн вк,9,-,-,-,-,-,-,-
реал мадрид смотреть онлайн вк,"1, 2",-,-,-,-,-,-,-
фильм онлайн 2022 вк смотреть,"1, 2",-,-,10,-,-,-,-
фильм ужасающий 3 смотреть онлайн бесплатно вк,1,-,-,-,-,-,-,-
ужасающий 3 фильм 2024 смотреть онлайн вк,1,-,-,-,-,-,-,-
сериалы 2023 смотреть онлайн вк,-,-,-,-,-,-,-,-
жизнь по вызову смотреть онлайн вк,10,-,-,-,-,-,-,-
пацаны смотреть онлайн бесплатно вк,1,-,-,-,-,-,-,-
лихие смотреть онлайн вк,10,-,-,-,-,-,-,-
игра смотреть онлайн бесплатно вк,6,-,-,-,-,-,10,-
веном последний танец смотреть онлайн вк,1,-,-,-,-,-,5,-
монте кристо смотреть онлайн вк,"4, 5",-,-,9,-,-,-,-
лунтик смотреть онлайн вк,9,-,-,-,-,-,-,-
последний богатырь смотреть онлайн вк,9,-,-,-,-,-,-,-
мать смотреть онлайн вк,1,-,-,7,-,-,2,-
граф монте кристо смотреть онлайн вк,"7, 8",-,-,-,-,-,-,-
юфс смотреть онлайн бесплатно вк,"1, 2",-,-,5,6,-,-,-
лунтик возвращение домой смотреть онлайн вк,8,-,-,-,-,-,-,-
дела смотреть онлайн бесплатно вк,"1, 2",-,-,7,-,-,-,-
смотреть новинки онлайн вк,"1, 2, 3",-,-,5,-,-,-,-
отчаянные домохозяйки смотреть онлайн бесплатно вк,"1, 2",-,-,3,-,-,-,-
слово пацана смотреть онлайн бесплатно вк,-,-,-,-,-,-,-,-
игра престолов смотреть онлайн вк,9,-,-,-,-,-,-,-
веном 3 смотреть онлайн бесплатно вк,2,-,-,-,-,-,-,-
вк смотреть онлайн бывшие,-,-,-,-,-,-,-,-
рай под ногами матерей смотреть онлайн вк,9,-,-,-,-,-,10,-
спартак смотреть онлайн вк,1,-,-,7,-,-,6,-
лунтик возвращение домой смотреть онлайн бесплатно вк,8,-,-,-,-,-,-,-
наследие смотреть онлайн вк,-,-,-,-,-,-,-,-
1 1 фильм смотреть онлайн вк,"6, 7",-,-,-,-,-,-,-
молодежка смотреть онлайн бесплатно вк,-,-,-,-,-,-,-,-
трасса смотреть онлайн бесплатно вк,9,-,-,-,-,-,-,-
сумерки смотреть онлайн вк,10,-,-,-,-,-,-,-
граф монте кристо 2024 смотреть онлайн вк,-,-,-,-,-,-,-,-
вызов смотреть онлайн бесплатно вк,7,-,-,10,-,-,9,-
ужасающий 2 смотреть онлайн бесплатно вк,-,-,-,-,-,-,-,-
гарри поттер смотреть онлайн бесплатно вк,"1, 2",-,-,5,-,-,-,-
дикий смотреть онлайн вк,5,-,-,-,-,-,-,-
реал боруссия смотреть онлайн вк,1,-,-,-,-,-,-,-
трасса сериал смотреть онлайн вк,10,-,-,-,-,-,-,-
юфс смотреть онлайн прямой вк,"1, 2",-,-,4,-,-,-,-
смотреть фильмы 2022 онлайн бесплатно вк,"1, 2",-,-,6,-,-,-,-
друзья смотреть онлайн вк,"1, 2",-,-,3,-,-,-,-
жизнь по вызову смотреть онлайн бесплатно вк,10,-,-,-,-,-,-,-
порно вк смотреть онлайн бесплатно,"1, 2",-,-,-,-,-,-,-
извне смотреть онлайн вк,1,-,-,3,-,-,-,-
джентльмены смотреть онлайн вк,8,-,-,9,-,-,-,-
кино вк смотреть онлайн в хорошем,"1, 2, 3",-,-,4,-,-,-,-
вк трансляции онлайн смотреть бесплатно,1,-,-,6,9,-,-,-
сериалы 2023 смотреть онлайн бесплатно вк,"1, 2",-,-,-,-,-,-,-
зимородок смотреть онлайн вк,-,-,-,-,-,-,-,-
турецкие сериалы вк языке смотреть онлайн,"8, 9",-,-,-,-,-,-,-
триггер смотреть онлайн вк,10,-,-,-,-,-,-,-
реал милан смотреть онлайн вк,-,-,-,-,10,-,-,-
жизнь сериал смотреть онлайн вк,9,-,-,-,-,-,-,-
ливерпуль смотреть онлайн вк,"1, 2",-,-,-,-,-,-,-
богатырь наследие смотреть онлайн вк,10,-,-,-,-,-,-,-
звезды вк смотреть онлайн,1,-,-,-,-,-,8,-
молодежка новая смена смотреть онлайн вк,-,-,-,-,-,-,-,-
смотреть вк анонимно онлайн,-,-,-,-,5,-,-,-
вк фильмы 2019 смотреть онлайн,1,-,-,9,-,-,-,-
невский 7 смотреть онлайн вк,-,-,-,-,-,-,-,-
последний богатырь смотреть онлайн бесплатно вк,10,-,-,-,-,-,-,-
последний богатырь наследие смотреть онлайн вк,10,-,-,-,-,-,-,-
чужой смотреть онлайн вк,"1, 2",-,-,3,-,-,-,-
аниме смотреть онлайн бесплатно вк,-,-,-,-,-,-,-,-
невский смотреть онлайн бесплатно вк,-,-,-,-,-,-,-,-
дневники вампира вк смотреть онлайн,1,-,-,2,-,-,-,-
смотреть онлайн время вк,1,-,-,-,6,-,-,-
мстители вк смотреть онлайн,1,-,-,2,-,-,-,-
юфс 308 онлайн бесплатно смотреть вк,-,-,-,-,-,-,-,-
вк мультики смотреть онлайн,"1, 2, 3",-,-,5,-,-,-,-
пацанки вк смотреть онлайн,1,-,-,-,-,-,-,-
вк видео смотреть онлайн фильмы 2024,"1, 2, 3",-,-,8,-,-,-,-
комбинация смотреть онлайн вк,"7, 8",-,-,-,-,-,-,-
смотреть фильмы онлайн через вк,"1, 2",-,-,10,7,-,-,-
юфс смотреть онлайн прямой эфир вк,-,-,-,-,-,-,-,-
новинки кино смотреть онлайн вк,"1, 2, 3",-,-,10,-,-,-,-
ufc смотреть онлайн бесплатно вк,1,-,-,-,-,-,-,-
невский 7 сезон смотреть онлайн вк,-,-,-,-,-,-,-,-
вк трансляции онлайн смотреть бесплатно прямой,1,-,-,7,-,-,-,-
пчеловод смотреть онлайн вк,-,-,-,-,-,-,-,-
вк клипы смотреть онлайн,"1, 2",-,-,4,6,-,-,-
детективы смотреть онлайн вк,"1, 2, 3",-,-,-,-,-,4,-
лихие смотреть онлайн бесплатно вк,8,-,-,-,-,-,-,-
субстанция смотреть онлайн вк видео,7,-,-,8,-,-,-,-
фильмы 2021 смотреть онлайн вк,"1, 2",-,-,9,-,-,-,-
веном последний танец смотреть онлайн бесплатно вк,1,-,-,-,-,-,10,-
мира смотреть онлайн бесплатно вк,7,-,-,-,-,-,10,-
маргарита смотреть онлайн вк,9,-,-,-,-,-,-,-
ходячие мертвецы смотреть онлайн вк,-,-,-,-,-,-,-,-
лихие сериал смотреть онлайн вк,9,-,-,-,-,-,-,-
бавария барселона смотреть онлайн вк,2,-,-,5,-,-,4,-
легенда смотреть онлайн вк,6,-,-,-,-,-,7,-
пингвин смотреть онлайн вк,1,-,-,2,-,-,-,-
сваты смотреть онлайн вк,"9, 10",-,-,-,-,-,-,-
мосгаз смотреть онлайн вк,9,-,-,-,-,-,-,-
игра престолов смотреть онлайн бесплатно вк,-,-,-,-,-,-,-,-
последний богатырь наследие смотреть онлайн бесплатно вк,-,-,-,-,-,-,-,-
наследники смотреть онлайн вк,"9, 10",-,-,-,-,-,-,-
сумерки смотреть онлайн бесплатно вк,"1, 2",-,-,3,-,-,6,-
властелин колец кольца смотреть онлайн вк,1,-,-,-,-,-,-,-
осман смотреть онлайн вк,7,-,-,-,-,-,-,-
секс смотреть онлайн вк,"1, 2",-,-,-,-,-,-,-
снукер смотреть онлайн вк,"1, 2",-,-,-,-,-,-,-
форсаж смотреть онлайн вк,1,-,-,8,-,-,-,-
истории вк смотреть онлайн бесплатно,-,-,-,-,8,-,-,-
начало смотреть онлайн вк,1,-,-,2,-,-,-,-
трасса сериал смотреть онлайн бесплатно вк,9,-,-,-,-,-,-,-
смотреть истории вк анонимно онлайн,-,-,-,-,-,-,-,-
смотреть футбол онлайн вк,"1, 2",-,-,-,-,-,-,-
сверхъестественное смотреть онлайн вк,1,-,-,2,-,-,-,-
граф монте кристо фильм смотреть онлайн вк,"6, 7",-,-,10,-,-,-,-
еретик смотреть онлайн вк,9,-,-,10,-,-,-,-
ужасы смотреть онлайн вк,"1, 2, 3",-,-,6,-,-,8,-
по поводу тенниса смотреть теннис онлайн вк,"1, 2",-,-,9,-,-,-,-
анора смотреть онлайн вк,10,-,-,-,-,-,-,-
комбинация смотреть онлайн бесплатно вк,7,-,-,-,-,-,-,-
вк онлайн смотреть сейчас,1,-,-,8,6,5,-,-
шрек смотреть онлайн вк,"1, 2",-,-,6,-,-,-,-
вверх смотреть онлайн вк,"1, 2",-,-,3,-,-,5,-
триггер смотреть онлайн бесплатно вк,10,-,-,-,-,-,-,-
извне 3 сезон смотреть онлайн вк,1,-,-,6,-,-,-,-
гусар смотреть онлайн вк,6,-,-,-,-,-,-,-
фильмы через вк смотреть онлайн бесплатно,"1, 2, 3",-,-,-,4,-,-,-
теория вк смотреть онлайн,1,-,-,4,-,-,-,-
джентльмены фильм смотреть онлайн вк,9,-,-,10,-,-,-,-
джокер смотреть онлайн вк,1,-,-,2,-,-,-,-
вк фильмы 2019 смотреть онлайн бесплатно,1,-,-,-,-,-,-,-
нхл смотреть онлайн вк,"1, 2, 3",-,-,-,-,-,-,-
мастер смотреть онлайн вк,"7, 8",-,-,-,-,-,10,-
2012 смотреть онлайн вк,"1, 2",-,-,4,-,-,-,-
реал мадрид милан смотреть онлайн вк,3,-,-,7,-,-,1,-
юфс смотреть бесплатно онлайн прямая вк,"1, 2",-,-,3,6,-,10,-
ворон смотреть онлайн вк,8,-,-,9,-,-,10,-
человек паук смотреть онлайн вк,1,-,-,2,-,-,-,-
граф монте кристо смотреть онлайн бесплатно вк,"6, 7",-,-,-,-,-,10,-
веном 3 последний танец смотреть онлайн вк,1,-,-,-,-,-,6,-
зло смотреть онлайн вк,-,-,-,-,-,-,-,-
великолепный вк смотреть онлайн,-,-,-,-,-,-,-,-
жизнь по вызову 3 смотреть онлайн вк,-,-,-,-,-,-,-,-
кстати вк смотреть онлайн,"1, 2",-,-,-,5,-,-,-
дэдпул смотреть онлайн вк,1,-,-,3,-,-,-,-
смотреть реал барселона онлайн вк,1,-,-,4,-,-,-,-
трансформеры смотреть онлайн вк,1,-,-,3,-,-,7,-
вк теория большого взрыва смотреть онлайн,-,-,-,-,-,-,-,-
боруссия реал мадрид смотреть онлайн вк,1,-,-,-,-,-,-,-
мажор смотреть онлайн вк,6,-,-,-,-,-,10,-
после смотреть онлайн вк,10,-,-,-,-,-,-,-
шеф смотреть онлайн вк,"1, 2",-,-,-,-,-,-,-
маме снова 17 смотреть онлайн вк,10,-,-,-,-,-,-,-
праздники смотреть онлайн вк,-,-,-,-,-,-,-,-
другие смотреть онлайн вк,7,-,-,-,-,-,-,-
три богатыря смотреть онлайн вк,-,-,-,-,-,-,-,-
комбинация сериал смотреть онлайн вк,8,-,-,-,-,-,-,-
ростов динамо смотреть онлайн вк,1,-,-,4,-,-,-,-
челси смотреть онлайн вк,"1, 2",-,-,-,-,-,-,-
дюна смотреть онлайн вк,9,-,-,10,-,-,-,-
молодежка новая смена смотреть онлайн бесплатно вк,9,-,-,-,-,-,-,-
пингвин сериал смотреть онлайн вк,1,-,-,2,-,-,-,-
мир дружба жвачка смотреть онлайн вк,6,-,-,10,-,-,-,-
сваты смотреть онлайн бесплатно вк,9,-,-,10,-,-,-,-
отпуск смотреть онлайн вк,5,-,-,-,-,-,-,-
пчеловод фильм смотреть онлайн вк,7,-,-,-,-,-,-,-
джентльмены смотреть онлайн бесплатно вк,9,-,-,10,-,-,-,-
трасса сериал 2024 смотреть онлайн вк,9,-,-,-,-,-,-,-
фильмы 2021 смотреть онлайн бесплатно вк,1,-,-,6,-,-,-,-
наследники дар крови смотреть онлайн вк,7,-,-,-,-,-,-,-
субстанция смотреть онлайн бесплатно вк видео,7,-,-,8,-,-,-,-
вк клипы смотреть онлайн бесплатно,"1, 2, 3",-,-,5,9,-,-,-
дикий робот смотреть онлайн вк,1,-,-,4,-,-,-,-
доктор хаус смотреть онлайн вк,5,-,-,-,-,-,-,-
куб смотреть онлайн вк,1,-,-,5,-,-,4,-
невский сериал смотреть онлайн вк,9,-,-,-,-,-,-,-
хороший человек смотреть онлайн вк,7,-,-,-,-,-,-,-
вк смотреть тв онлайн,1,-,-,3,-,-,-,-
бывшие смотреть онлайн бесплатно вк,-,-,-,-,-,-,-,-
великолепный век смотреть онлайн вк,-,-,-,-,-,-,-,-
ворон 2024 смотреть онлайн вк,-,-,-,-,-,-,-,-
полицейский с рублевки смотреть онлайн вк,8,-,-,-,-,-,-,-
субстанция фильм смотреть онлайн вк видео,-,-,-,-,-,-,-,-
веном 2024 смотреть онлайн вк,"1, 2",-,-,4,-,-,7,-
ужасы смотреть онлайн бесплатно вк,"1, 2, 3",-,-,7,-,-,6,-
лихие сериал смотреть онлайн бесплатно вк,-,-,-,-,-,-,-,-
министерство неджентльменских дел смотреть онлайн вк,7,-,-,-,-,-,-,-
министерство неджентльменских смотреть онлайн вк,-,-,-,-,-,-,-,-
пчеловод смотреть онлайн бесплатно вк,"6, 7",-,-,10,-,-,-,-
великая смотреть онлайн вк,-,-,-,-,-,-,-,-
побег смотреть онлайн вк,"1, 2",-,-,3,-,-,-,-
триггер 3 сезон смотреть онлайн вк,-,-,-,-,-,-,-,-
вк комедии смотреть онлайн,"1, 2",-,-,5,-,-,-,-
мстители смотреть онлайн бесплатно вк,1,-,-,2,-,-,-,-
улыбка смотреть онлайн вк,1,-,-,4,-,-,2,-
натальная карта смотреть онлайн вк,"1, 2",-,-,-,-,-,-,-
фильм смотреть онлайн бесплатно вк видео русские,"1, 2",-,-,3,-,-,-,-
юфс смотреть онлайн прямой эфир бесплатно вк,-,-,-,-,-,-,-,-
джентльмены 2019 смотреть онлайн вк,-,-,-,-,-,-,-,-
невский 1 сезон смотреть онлайн вк,8,-,-,-,-,-,-,-
бригада смотреть онлайн вк,"1, 2",-,-,3,-,-,-,-
мелодрамы в вк смотреть онлайн,"1, 2, 3",-,-,-,-,-,-,-
новинки кино смотреть онлайн бесплатно вк,"1, 2, 3",-,-,6,-,-,-,-
пацанки 9 сезон смотреть онлайн вк,-,-,-,6,-,-,-,-
молодежка новый сезон смотреть онлайн вк,-,-,-,-,-,-,-,-
извне смотреть онлайн бесплатно вк,1,-,-,3,-,-,-,-
каникулы смотреть онлайн вк,1,-,-,8,-,-,5,-
фильм 2020 смотреть онлайн вк,1,-,-,8,-,-,-,-
еретик 2024 смотреть онлайн вк,9,-,-,-,-,-,-,-
снукер онлайн трансляции вк смотреть,"1, 2",-,-,-,-,-,-,-
триггер сериал смотреть онлайн вк,10,-,-,-,-,-,-,-
аватар смотреть онлайн вк,"1, 2",-,-,5,-,-,-,-
время смотреть онлайн бесплатно вк,1,-,-,3,-,-,5,-
парни онлайн смотреть вк,1,-,-,-,-,-,-,6
руки вверх фильм смотреть онлайн вк,-,-,-,-,-,-,-,-
мультики вк смотреть онлайн бесплатно,"1, 2, 3",-,-,6,5,-,-,-
росомаха смотреть онлайн вк,1,-,-,2,-,-,3,-
гладиатор смотреть онлайн вк,1,-,-,2,-,-,6,-
сто лет тому вперед смотреть онлайн вк,9,-,-,-,-,-,-,-
фильмы hd смотреть бесплатно онлайн вк,"1, 2",-,-,6,-,-,-,-
эйфория смотреть онлайн вк,-,-,-,-,-,-,-,-
извне сериал смотреть онлайн вк,1,-,-,4,-,-,-,-
трасса смотреть онлайн бесплатно 2024 вк,-,-,-,-,-,-,-,-
фильм чужая смотреть онлайн вк,-,-,-,-,-,-,-,-
вк плей смотреть онлайн,2,-,-,6,-,-,-,-
жить жизнь смотреть онлайн вк,8,-,-,-,-,-,-,-
счастье вк смотреть онлайн,"1, 2",-,-,-,-,-,6,-
миссия красный смотреть онлайн вк,2,-,-,-,-,-,-,-
18 вк смотреть онлайн,1,-,10,-,5,-,3,-
маме снова 17 фильм смотреть онлайн вк,-,-,-,-,-,-,-,-
порно видео смотреть онлайн вк,"1, 2, 3",-,-,-,-,-,-,-
бойцовский клуб смотреть онлайн вк,9,-,-,10,-,-,-,-
спартак акрон смотреть онлайн вк,3,-,-,1,-,-,-,-
снукер вк смотреть онлайн прямая трансляция сейчас,1,-,-,-,-,-,-,-
джон уик смотреть онлайн вк,-,-,-,-,-,-,-,-
огонь смотреть онлайн вк,10,-,-,-,-,-,-,-
сестры смотреть онлайн вк,-,-,-,-,-,-,-,-
субстанция фильм смотреть онлайн бесплатно вк видео,-,-,-,-,-,-,-,-
