queries,vk.com,m.vk.com,vk.company,rutube.ru,dzen.ru,twitter.com,ok.ru,www.instagram.com
гримм смотреть онлайн бесплатно вк,"1, 2",-,-,4,-,-,10,-
мультфильмы 2022 смотреть онлайн вк,1,-,-,4,-,-,-,-
отчаянные домохозяйки смотреть онлайн 2 сезон вк,1,-,-,2,-,-,-,-
патруль смотреть онлайн вк,1,-,-,-,-,-,4,-
реал боруссия дортмунд смотреть онлайн вк,2,-,-,-,-,-,5,-
смотреть чебурашку онлайн вк,7,-,-,10,-,-,-,-
царство смотреть онлайн вк,1,-,-,2,-,-,-,-
гнев человеческий фильм смотреть онлайн вк,9,-,-,-,-,-,-,-
извне сериал смотреть онлайн бесплатно вк,1,-,-,4,-,-,-,-
новичок смотреть онлайн вк,-,-,-,-,-,-,-,-
вк музыка смотреть онлайн бесплатно,"1, 2",-,-,7,3,-,-,4
невский смотреть онлайн вк видео,"9, 10",-,-,-,-,-,-,-
веном смотреть онлайн вк видео,1,-,-,2,-,-,-,-
наследники сериал смотреть онлайн бесплатно вк,-,-,-,-,-,-,-,-
россия 24 онлайн смотреть вк,-,-,-,-,-,-,-,-
вечные смотреть онлайн вк,1,-,-,-,-,-,6,-
гадкий я смотреть онлайн бесплатно вк,10,-,-,-,-,-,-,-
гусар сериал смотреть онлайн вк,10,-,-,-,-,-,-,-
жить жизнь 2 смотреть онлайн вк,-,-,-,-,-,-,-,-
реал барса смотреть онлайн вк,1,-,-,6,-,-,-,-
соник смотреть онлайн вк,"1, 2",-,-,4,-,-,-,-
триггер 3 сезон сериал смотреть онлайн вк,-,-,-,-,-,-,-,-
шрек 2 смотреть онлайн вк,8,-,-,10,-,-,-,-
гладиатор смотреть онлайн бесплатно вк,1,-,-,2,-,-,7,-
доктор хаус смотреть онлайн бесплатно вк,-,-,-,-,-,-,-,-
краснодар оренбург смотреть онлайн вк,1,-,-,3,-,-,-,-
невский близкий враг смотреть онлайн вк,-,-,-,-,-,-,-,-
осман сериал смотреть онлайн вк,8,-,-,-,-,-,-,-
первый мститель смотреть онлайн вк,1,-,-,2,-,-,5,-
веном 2 смотреть онлайн бесплатно вк,1,-,-,2,-,-,-,-
джокер безумие на двоих смотреть онлайн вк,1,-,-,2,-,-,-,-
дикий робот мультфильм смотреть онлайн вк,1,-,-,3,-,-,-,-
еретик фильм смотреть онлайн бесплатно вк,9,-,-,10,-,-,-,-
игра сериал смотреть онлайн вк,2,-,-,-,-,-,3,-
россия 24 прямой эфир смотреть онлайн вк,-,-,-,-,-,-,-,-
смотреть онлайн бесплатно секс вк,"1, 2",-,-,-,-,-,-,-
тест на беременность смотреть онлайн вк,1,-,-,-,-,-,2,-
веном 1 смотреть онлайн вк,1,-,-,2,-,-,-,-
жуки смотреть онлайн вк,10,-,-,-,-,-,-,-
зона комфорта смотреть онлайн бесплатно вк,9,-,-,-,-,-,-,-
интер арсенал смотреть онлайн вк,8,-,-,-,-,-,-,-
конец света смотреть онлайн вк,1,-,-,-,-,-,-,-
отпуск смотреть онлайн бесплатно в вк,6,-,-,-,-,-,-,-
отчий берег смотреть онлайн вк,-,-,-,-,-,-,-,-
руки вверх смотреть онлайн в вк,"8, 9",-,-,-,-,-,-,-
след смотреть онлайн вк,-,-,-,-,-,-,-,-
великолепный век смотреть онлайн бесплатно вк,-,-,-,-,-,-,-,-
время жить смотреть онлайн вк,8,-,-,-,-,-,-,-
джек ричер смотреть онлайн вк,"1, 2",-,-,3,-,-,8,-
метод смотреть онлайн вк,8,-,-,-,-,-,-,-
порно видео вк смотреть онлайн бесплатно,"1, 2, 3",-,-,-,-,-,-,-
почему женщины убивают смотреть онлайн вк,9,-,-,-,-,-,-,-
против всех смотреть онлайн вк,-,-,-,-,-,-,-,-
слово пацана 1 смотреть онлайн вк,10,-,-,-,-,-,-,-
смотреть профиль вк онлайн,-,-,-,9,-,-,-,-
улыбка 2 смотреть онлайн вк,1,-,-,2,-,-,7,-
баскетбол смотреть онлайн вк,"1, 2",-,-,5,-,-,-,-
бременские музыканты фильм смотреть онлайн вк,8,-,-,-,-,-,-,-
властелин колец 1 смотреть онлайн вк,1,-,-,3,-,-,-,-
гусар 2 сезон смотреть онлайн вк,3,-,-,-,-,-,-,-
дневники вампира смотреть онлайн вк 3 сезон,1,-,-,3,-,-,-,-
мастер и маргарита 2024 смотреть онлайн вк,8,-,-,-,-,-,-,-
пацанки 2024 смотреть онлайн вк,1,-,-,-,-,-,-,-
слово пацана смотреть онлайн вк видео,-,-,-,-,-,-,-,-
дом дракона смотреть онлайн в вк,9,-,-,-,-,-,-,-
ловушка фильм смотреть онлайн вк,1,-,-,3,-,-,-,-
vk смотреть онлайн,1,-,-,-,3,-,-,-
смотреть онлайн бесплатно vk,1,-,-,-,3,-,-,-
vk видео смотреть онлайн,"1, 2",-,-,-,3,-,-,-
vk видео смотреть онлайн бесплатно,1,-,-,-,2,-,-,-
vk смотреть фильмы онлайн,"1, 2",-,-,5,-,-,-,-
смотреть сериалы онлайн vk,"1, 2",-,-,-,-,-,-,-
vk сериалы смотреть онлайн бесплатно,"1, 2",-,-,-,-,-,-,-
vk фильмы онлайн смотреть бесплатно,"1, 2, 3",-,-,8,-,-,-,-
vk смотреть онлайн бесплатно без регистрации,1,-,-,-,3,-,-,-
vk видео смотреть онлайн без регистрации,1,-,-,-,2,-,-,-
vk видео смотреть онлайн бесплатно без регистрации,"1, 2",-,-,-,3,-,-,-
vk видео смотреть фильмы онлайн,"1, 2",-,-,5,-,-,-,-
1 1 смотреть онлайн vk,"1, 2",-,-,7,-,-,6,-
смотреть онлайн vk com,1,-,-,-,3,-,-,9
vk видео смотреть онлайн бесплатно фильмы,1,-,-,3,-,-,-,-
смотреть онлайн на русском vk,1,-,-,-,8,-,-,-
vk видео смотреть онлайн бесплатно сериал,"1, 2",-,-,10,-,-,-,-
vk com смотреть онлайн бесплатно,1,-,-,-,3,-,-,-
русский сериал смотреть онлайн vk,"1, 2",-,-,-,-,-,-,-
vk video смотреть онлайн бесплатно,1,-,-,-,2,-,-,-
фильмы 2024 смотреть онлайн vk,"1, 2",-,-,9,-,-,-,-
vk ufc смотреть онлайн,1,-,-,2,9,-,-,-
смотреть https vk com онлайн,"1, 2",-,-,-,6,5,4,-
vk com видео онлайн смотреть,1,-,-,-,2,-,-,-
фильмы 2024 смотреть онлайн бесплатно vk,"1, 2, 3",-,-,-,-,-,-,-
аниме смотреть онлайн m vk com,"1, 2",-,-,4,-,-,-,-
vk видео смотреть онлайн бесплатно вконтакте,"1, 2",-,-,-,4,-,-,-
турецкие сериалы смотреть на vk онлайн,"1, 2",-,-,-,-,-,7,-
субстанция смотреть онлайн vk,8,-,-,9,-,-,-,-
ufc 308 смотреть онлайн vk,-,-,-,-,-,-,-,-
смотреть порно онлайн vk,"1, 2, 3",-,-,-,-,-,-,-
мультфильм смотреть онлайн vk,"1, 2",-,-,5,9,-,-,-
меню смотреть онлайн vk,1,-,-,4,-,-,5,-
субстанция фильм смотреть онлайн vk,-,-,-,-,-,-,-,-
vk смотреть онлайн трансляции,1,-,-,5,6,-,-,-
мира смотреть онлайн vk,9,-,-,-,-,-,-,-
смотреть ufc онлайн бесплатно vk,1,-,-,3,10,-,-,-
vk теннис смотреть онлайн,"1, 2",-,-,-,-,-,-,-
игра смотреть онлайн vk,5,-,-,-,-,-,8,-
сериалы 2022 смотреть онлайн vk,1,-,-,-,-,-,-,-
фильмы 2023 смотреть онлайн vk,"1, 2",-,-,-,-,-,-,-
смотреть онлайн кино vk,"1, 2",-,-,5,-,-,-,-
пацаны смотреть онлайн vk,1,-,-,-,-,-,-,-
субстанция 2024 смотреть онлайн vk,-,-,-,-,-,-,-,-
слово пацана смотреть онлайн vk,10,-,-,-,-,-,-,-
ufc 308 смотреть онлайн бесплатно vk,-,-,-,-,-,-,-,-
субстанция смотреть онлайн бесплатно vk,9,-,-,10,-,-,-,-
vk клипы смотреть онлайн,"1, 2, 3",-,-,6,9,-,-,-
смотреть онлайн hd в vk,"1, 2, 3",-,-,7,-,-,-,-
смотреть фильмы онлайн vk com,"1, 2",-,-,7,-,-,-,-
рутуб смотреть онлайн,3,-,-,"1, 2",5,9,-,10
рутуб смотреть онлайн бесплатно,3,-,-,"1, 2",5,-,-,-
рутуб смотреть онлайн бесплатно в хорошем,3,-,-,"1, 2",5,-,-,-
рутуб смотреть онлайн в хорошем качестве,3,-,-,"1, 2",5,10,-,-
рутуб смотреть бесплатно онлайн в хорошем качестве,3,-,-,"1, 2",5,-,-,-
рутуб фильмы смотреть онлайн,3,-,-,"1, 2",4,-,-,-
рутуб смотреть онлайн сериалы,4,-,-,"1, 2",9,-,-,-
рутуб смотреть фильмы онлайн бесплатно,3,-,-,"1, 2",4,-,-,-
рутуб смотреть без регистрации онлайн,3,-,-,"1, 2",4,-,-,-
рутуб смотреть без регистрации бесплатно онлайн,3,-,-,"1, 2",4,-,-,-
рутуб смотреть фильмы онлайн бесплатно в хорошем,3,-,-,"1, 2",-,-,-,-
сериалы смотреть онлайн лучшие рутубе,6,-,-,"1, 2",10,-,-,-
1 1 смотреть онлайн рутуб,4,-,-,1,-,-,-,-
рутуб смотреть без регистрации на русском онлайн,3,-,-,"1, 2",4,-,-,-
смотреть рутуб онлайн без рекламы,3,-,-,"1, 2",6,-,-,-
смотреть сериалы на рутубе онлайн бесплатно,7,-,-,"1, 2",6,-,-,-
звезды смотреть онлайн рутуб,7,-,-,1,-,-,-,-
звезды в джунглях смотреть онлайн рутуб,10,-,-,"1, 2, 3",-,-,-,-
рутубе смотреть онлайн русские фильмы,2,-,-,1,4,-,-,-
рутуб мультфильмы смотреть онлайн,-,-,-,"1, 2, 3",4,-,9,-
рутуб фильмы 2024 смотреть онлайн,-,-,-,"1, 2, 3",-,-,-,-
рутуб смотреть онлайн прямой,4,-,-,"1, 2",6,9,-,-
рутуб смотреть онлайн прямой эфир,4,-,-,"1, 2",5,-,-,-
манюня смотреть онлайн рутубе,-,-,-,"9, 10",-,-,-,-
манюня смотреть онлайн бесплатно рутуб,-,-,-,6,-,-,-,-
отчаянные домохозяйки смотреть онлайн рутуб,4,-,-,"1, 2, 3",-,-,-,-
манюня сериал смотреть онлайн бесплатно рутубе,-,-,-,9,-,-,-,-
субстанция смотреть онлайн рутуб,-,-,-,10,-,-,-,-
рутуб экстрасенсы смотреть онлайн,9,-,-,"1, 2, 3, 4",-,-,-,-
смотреть фильмы онлайн бесплатно русские на рутубе,2,-,-,1,3,-,-,-
сериалы русские смотреть онлайн рутубе,8,-,-,"1, 2",-,-,-,-
фильмы 2024 смотреть онлайн бесплатно рутуб,-,-,-,"1, 2, 3",-,-,-,-
рутуб смотреть мультфильмы онлайн бесплатно,-,-,-,"1, 2, 3",4,-,6,-
рутуб онлайн смотреть бесплатно прямой,4,-,-,"1, 2",6,-,-,-
рутуб смотреть онлайн прямой эфир бесплатно,6,-,-,"1, 2, 3",5,-,-,-
звезды в джунглях смотреть онлайн 2024 рутуб,-,-,-,"1, 2",-,-,-,-
рутуб смотреть фильмы онлайн бесплатно 2023,4,-,-,"1, 2, 3",-,-,-,-
рутуб смотреть фильмы онлайн бесплатно без регистрации,4,-,-,"1, 2",5,-,-,-
коте смотреть онлайн рутуб,8,-,-,"1, 2, 3",4,-,-,-
канал рутуб смотреть онлайн,2,-,-,1,3,9,-,-
мужское женское смотреть онлайн рутуб,-,-,-,1,10,-,-,-
экстрасенсы смотреть онлайн бесплатно рутуб,4,-,-,"1, 2, 3",-,-,-,-
отчаянные домохозяйки смотреть онлайн бесплатно рутуб,3,-,-,"1, 2",-,-,-,-
экстрасенсы реванш смотреть онлайн рутуб,-,-,-,"1, 2, 3",-,-,-,-
рутуб кино смотреть онлайн,3,-,-,"1, 2",4,-,-,-
рутуб смотреть онлайн прямой эфир сейчас,4,-,-,"1, 2",5,-,-,-
звезды в джунглях смотреть онлайн бесплатно рутуб,-,-,-,"1, 2",-,-,-,-
невский смотреть онлайн рутуб,-,-,-,8,-,-,-,-
ходячие мертвецы смотреть онлайн рутуб,4,-,-,"1, 2, 3",-,-,-,-
битва экстрасенсов смотреть онлайн рутуб,4,-,-,"1, 2, 3",-,-,-,-
слово пацана 2 сезон смотреть онлайн рутуб,-,-,-,-,-,-,-,-
трудные подростки смотреть онлайн бесплатно рутуб,-,-,-,6,-,-,-,-
холодное сердце смотреть онлайн рутуб,5,-,-,"1, 2",-,-,-,-
черная любовь смотреть онлайн бесплатно рутубе,-,-,-,-,-,-,-,-
50 оттенков серого смотреть онлайн бесплатно рутуб,4,-,-,1,-,-,-,-
давай поженимся смотреть онлайн бесплатно рутуб,3,-,-,1,4,-,-,-
офис смотреть онлайн рутуб,-,-,-,"1, 2",-,-,-,-
рутуб 5 канал смотреть онлайн,-,-,-,"1, 2",-,-,-,-
рутуб смотреть онлайн фильм ужасы,3,-,-,"1, 2",-,-,5,-
сплетница смотреть онлайн бесплатно рутуб,-,-,-,"1, 2",-,-,-,-
супер ниндзя 3 сезон смотреть онлайн рутуб,-,-,-,-,-,-,-,-
унесенные призраками смотреть онлайн бесплатно рутуб,-,-,-,-,-,-,-,-
бумажный дом сериал смотреть онлайн рутубе,3,-,-,"1, 2",-,-,5,-
головоломка 2 смотреть онлайн бесплатно рутуб,2,-,-,-,-,-,-,-
лиса сериал смотреть онлайн рутуб,-,-,-,10,-,-,-,-
мандалорец рутуб смотреть онлайн бесплатно,-,-,-,-,-,-,-,-
министерство неджентльменских дел смотреть онлайн рутуб,-,-,-,7,-,-,-,-
отчаянные домохозяйки смотреть онлайн рутуб 8 сезон,3,-,-,"1, 2",-,-,-,-
рутуб детский смотреть онлайн бесплатно,9,-,-,"1, 2, 3",4,-,8,-
сквозь снег сериал смотреть онлайн рутуб,-,-,-,-,-,-,-,-
большое переселение шоу смотреть онлайн рутуб,-,-,-,"1, 2",-,-,-,-
йеллоустоун сериал смотреть онлайн бесплатно рутуб,5,-,-,"1, 2",-,-,4,-
как приручить дракона 1 смотреть онлайн рутуб,4,-,-,1,-,-,5,-
настоящий детектив сериал смотреть онлайн рутуб,-,-,-,-,-,-,-,-
по щучьему велению смотреть онлайн рутуб,-,-,-,"8, 9",-,-,-,-
экстрасенсы 21 смотреть онлайн бесплатно рутуб,4,-,-,"1, 2",-,-,-,-
жыыызнь смотреть онлайн рутуб,-,-,-,"8, 9",-,-,-,-
никто смотреть онлайн рутуб,4,-,-,1,-,-,-,-
осд смотреть онлайн рутуб,-,-,-,"1, 2, 3",-,-,-,-
пацанки 9 смотреть онлайн бесплатно рутуб,3,-,-,1,-,-,-,-
семейка крудс смотреть онлайн рутуб,3,-,-,1,-,-,7,-
синяя тюрьма аниме смотреть онлайн бесплатно рутубе,-,-,-,9,-,-,-,-
дэрил диксон смотреть онлайн рутуб,-,-,-,-,-,-,-,-
железный человек смотреть онлайн рутуб,4,-,-,"1, 2, 3",-,-,-,-
онлайн смотреть россия 24 рутубе,-,-,-,-,-,-,-,-
последний богатырь 1 смотреть онлайн рутуб,-,-,-,-,-,-,-,-
рутуб смотреть онлайн настя,-,-,-,"1, 2",3,-,5,-
рутуб смотреть сериал след 2024 онлайн,-,-,-,-,-,-,-,-
шрек 2 смотреть онлайн бесплатно рутуб,-,-,-,-,-,-,-,-
вызов смотреть онлайн 2024 рутуб,-,-,-,-,-,-,-,-
доктор в кризисе дорама смотреть онлайн рутубе,5,-,-,"1, 2",-,-,-,-
клюквенный щербет 3 сезон смотреть онлайн рутубе,-,-,-,8,9,-,-,-
корабль смотреть онлайн рутуб,4,-,-,1,-,-,-,-
реальные пацаны смотреть онлайн бесплатно рутуб,-,-,-,-,-,-,-,-
рутуб смотреть онлайн бесплатно рассказы,3,-,-,1,-,-,4,-
смотреть в рутубе охоты онлайн,4,-,-,"1, 2",3,-,-,-
спанч боб смотреть онлайн рутуб,-,-,-,-,-,-,-,-
титаник смотреть онлайн рутуб,-,-,-,"1, 2, 3",-,-,5,-
чужой ромул смотреть онлайн бесплатно рутубе,9,-,-,-,-,-,-,-
бойцовский клуб фильм смотреть онлайн бесплатно рутуб,4,-,-,"1, 2",-,-,7,-
внешние отмели смотреть онлайн рутуб,3,-,-,1,-,-,7,-
губка боб смотреть онлайн рутуб,-,-,-,-,-,-,-,-
отчаянные домохозяйки рутуб все серии смотреть онлайн,3,-,-,"1, 2",-,-,-,-
рутуб смотреть онлайн политика,6,-,-,"1, 2, 3, 4",7,-,10,-
смотреть онлайн бесплатно женское дело рутубе,-,-,-,-,-,-,-,-
смотреть фильмы онлайн бесплатно через рутуб,4,-,-,"1, 2, 3",5,-,-,-
боевики смотреть на рутубе онлайн бесплатно,2,-,-,1,-,-,10,-
вечные фильм смотреть онлайн рутуб,-,-,-,3,-,-,-,-
во все тяжкие сериал смотреть онлайн рутуб,10,-,-,"1, 2, 3",-,-,-,-
джентльмены 2019 смотреть онлайн рутуб,-,-,-,10,-,-,-,-
пассажиры смотреть онлайн рутуб,-,-,-,-,-,-,-,-
пацаны смотреть онлайн рутуб сериал бесплатно,4,-,-,1,-,-,-,-
смотреть онлайн без меня рутубе бесплатно,3,-,-,1,6,-,2,-
телохранители смотреть онлайн рутуб,-,-,-,9,-,-,-,-
энканто смотреть онлайн рутубе,3,-,-,"1, 2",-,-,-,-
зверополис смотреть онлайн рутуб,-,-,-,"1, 2",-,-,-,-
мое прекрасное несчастье смотреть онлайн рутуб,-,-,-,8,-,-,-,-
смотреть фильмы онлайн лордфильм бесплатно рутубе,-,-,-,6,-,-,-,-
ходячий замок смотреть онлайн рутуб,-,-,-,5,9,-,-,-
ведьмина служба доставки смотреть онлайн рутуб,-,-,-,-,-,-,-,-
веном 1 смотреть онлайн рутуб,8,-,-,"1, 2",-,-,-,-
дом 2 на рутубе смотреть бесплатно онлайн,-,-,-,10,-,-,-,-
менталист сериал смотреть онлайн рутуб,-,-,-,"1, 2",-,-,-,-
свинка пеппа смотреть онлайн рутуб,5,-,-,"1, 2",7,-,8,-
слепая смотреть онлайн рутуб,-,-,-,8,-,-,-,-
тьма смотреть онлайн бесплатно рутуб,8,-,-,"1, 2, 3",-,-,5,-
убить волка дорама смотреть онлайн бесплатно рутубе,3,-,-,1,-,-,5,-
выжить в джунглях смотреть онлайн рутуб,-,-,-,1,-,-,-,-
два холма смотреть онлайн рутуб,-,-,-,8,-,-,-,-
как приручить дракона 3 смотреть онлайн рутуб,3,-,-,1,-,-,6,-
милые обманщицы сериал смотреть онлайн рутуб,-,-,-,-,-,-,-,-
пацанки 9 сезон смотреть онлайн бесплатно рутуб,2,-,-,1,-,-,-,-
признания убийцы нетфликс смотреть онлайн рутубе,4,-,-,"1, 2",-,-,6,-
рутуб смотреть онлайн бесплатно новости сегодня,4,-,-,"1, 2, 3",7,-,-,-
сериал зло смотреть онлайн рутуб,-,-,-,-,-,-,-,-
симпсоны смотреть онлайн рутуб,1,-,-,-,-,-,-,-
супермен и лоис смотреть онлайн рутуб,-,-,-,2,-,-,-,-
универ новая общага смотреть онлайн бесплатно рутуб,-,-,-,9,-,-,-,-
гусар 2 сезон сериал смотреть онлайн рутуб,-,-,-,-,-,-,-,-
извне 3 сезон смотреть онлайн бесплатно рутубе,6,-,-,"1, 2",-,-,-,-
клюквенный щербет смотреть онлайн бесплатно на рутубе,-,-,-,9,-,-,-,-
люцифер смотреть онлайн рутуб,8,-,-,"1, 2, 3",-,-,-,-
метод сериал смотреть бесплатно онлайн рутубе,-,-,-,-,-,-,-,-
мультики для детей смотреть онлайн бесплатно рутуб,5,-,-,"1, 2, 3",4,-,6,-
ольга смотреть онлайн бесплатно рутуб,7,-,-,6,-,-,-,-
рыбалка рутуб смотреть онлайн,5,-,-,"1, 2, 3",4,-,-,-
слово пацана сериал смотреть онлайн рутуб,-,-,-,-,-,-,-,-
смотреть онлайн мужское женское рутуб 2023,-,-,-,"1, 2",-,-,-,-
стендап смотреть онлайн рутуб,4,-,-,1,8,-,-,-
чужой ромул фильм 2024 смотреть онлайн рутуб,-,-,-,9,-,-,-,-
американская история ужасов смотреть онлайн рутуб,3,-,-,1,-,-,-,-
астрал смотреть онлайн рутубе,3,-,-,"1, 2",-,-,6,-
бременские музыканты фильм смотреть онлайн рутубе,8,-,-,"5, 6",-,-,-,-
властелин колец кольца власти смотреть онлайн рутуб,-,-,-,1,-,-,-,-
жыыызнь сериал смотреть онлайн рутуб,-,-,-,8,-,-,-,-
кунг фу панда 3 смотреть онлайн рутуб,1,-,-,2,-,-,-,-
лед смотреть онлайн рутуб,-,-,-,-,-,-,-,-
один дома смотреть онлайн рутуб,6,-,-,"1, 2",-,-,7,-
подоляка последний выпуск сегодня рутуб смотреть онлайн,-,-,-,1,-,-,-,-
против всех смотреть онлайн рутубе,-,-,-,-,-,-,-,-
пятница смотреть онлайн бесплатно рутуб,8,-,-,"1, 2",-,-,-,-
ужасающий 1 смотреть онлайн бесплатно рутуб,10,-,-,9,-,-,-,-
юрий подоляко рутуб смотреть онлайн,-,-,-,"1, 2, 3",10,-,9,-
гримм сериал смотреть онлайн рутуб,4,-,-,"1, 2",-,-,-,-
дивергент смотреть онлайн рутуб,8,-,-,6,-,-,-,-
клан сопрано смотреть онлайн рутуб,-,-,-,-,-,-,-,-
красная королева смотреть онлайн рутубе,-,-,-,-,-,-,-,-
рутуб смотреть онлайн бесплатно майнкрафт,9,-,-,"1, 2, 3",4,-,5,-
сериал большой потенциал смотреть онлайн рутуб,-,-,-,"1, 2",-,-,-,-
сериал кровавая барыня смотреть онлайн рутубе,-,-,-,10,-,-,-,-
сериал лихие 2024 смотреть онлайн рутуб,-,-,-,10,-,-,-,-
сериал сверхъестественное смотреть онлайн бесплатно рутуб,-,-,-,"1, 2",-,-,-,-
след 2024 смотреть рутуб онлайн бесплатно,-,-,-,-,-,-,-,-
тарас бульба смотреть онлайн рутуб,-,-,-,-,-,-,-,-
твин пикс смотреть онлайн рутубе,6,-,-,1,-,-,-,-
форма голоса смотреть онлайн рутубе,-,-,-,-,-,-,-,-
чебурашка фильм смотреть онлайн бесплатно рутуб,-,-,-,9,-,-,-,-
